<!ELEMENT personas (persona+)>
<!ELEMENT persona (nombre, edad)>
<!ELEMENT nombre (#PCDATA)>
<!ELEMENT edad (#PCDATA)>
<!ATTLIST persona genero (masculino | femenino | "no binario") #REQUIRED>
